{
  "rubric_version": "v0 (RAND Paskov et al. 2025 dimensions, 0-4 per dimension; 15 checklist items D1-Do7)",
  "sweep_date": "2026-07-12",
  "assessment": {
    "produced_by": "AI-assisted sweep (Claude, Claude Code session), directed by Andrés Cotton",
    "human_reviewed": false,
    "method": "Three parallel research agents fetched primary sources; findings consolidated, scored 0-4 per rubric dimension with per-checklist-item verdicts (met/partial/not met/not reported/not verified); every URL live-checked at sweep time.",
    "detail_pages": "Per-eval item-by-item findings, evidence tiers, and epistemic-status blocks live on each eval's Notion row page and in research/sweeps/01-no-sycophancy.md (Appendix A holds the verdict matrix)."
  },
  "evals": [
    {
      "id": "sycophancy-eval-sharma-2023",
      "name": "SycophancyEval",
      "url": "https://arxiv.org/abs/2310.13548",
      "org": "Sharma et al. 2023, Anthropic (ICLR 2024)",
      "notion_page": "https://app.notion.com/p/39c3e0f93a8081278d78e733ecbe5f92",
      "sources": [
        { "label": "paper (arXiv 2310.13548)", "url": "https://arxiv.org/abs/2310.13548", "status": "fetched, live 2026-07-12" },
        { "label": "ICLR 2024 poster page", "url": "https://iclr.cc/virtual/2024/poster/17593", "status": "fetched; confirms acceptance" },
        { "label": "OpenReview forum", "url": "https://openreview.net/forum?id=tvhaxkMKAn", "status": "exists; Cloudflare-gated -- reviews not read" },
        { "label": "code + datasets", "url": "https://github.com/meg-tong/sycophancy-eval", "status": "fetched; datasets downloaded and line-counted (8500/4887/7267)" },
        { "label": "UK AISI inspect_evals port", "url": "https://github.com/UKGovernmentBEIS/inspect_evals", "status": "fetched, live" },
        { "label": "port docs", "url": "https://ukgovernmentbeis.github.io/inspect_evals/evals/assistants/sycophancy/", "status": "fetched, live" },
        { "label": "critique: no human validation (arXiv 2512.00656)", "url": "https://arxiv.org/abs/2512.00656", "status": "fetched, live" },
        { "label": "critique: propositional-only scope (ELEPHANT)", "url": "https://arxiv.org/abs/2505.13995", "status": "fetched, live" }
      ],
      "behaviour_ids": [1],
      "facets": ["1.1", "1.2", "1.3"],
      "quality": { "internal_validity": 3, "external_validity": 3, "reproducibility": 3 },
      "quality_confidence": { "internal_validity": "high", "external_validity": "medium", "reproducibility": "high" },
      "adherence": {
        "anthropic": { "band": 1, "provenance": "claude-1.3 wrongly apologized on 98% of are-you-sure challenges where originally correct (2023 model; historical)" },
        "openai": { "band": 2, "provenance": "gpt-4 'the most robust' yet sycophantic on all four tasks (2023 model; historical)" }
      },
      "featured": true,
      "notes": "Only eval covering all three facets: answer sycophancy (7,267 items) = 1.1, feedback wrote/didn't-write arm (8,500) = 1.2, are-you-sure (4,887) = 1.3. Data public; UK AISI inspect_evals maintains a runnable port of are-you-sure. Held back by GPT-4-judge circularity, SEs only, no turnkey grading code, mimicry dataset unreleased."
    },
    {
      "id": "brokenmath-petrov-2025",
      "name": "BrokenMath",
      "url": "https://arxiv.org/abs/2510.04721",
      "org": "Petrov et al. 2025, INSAIT / ETH Zurich (NeurIPS 2025)",
      "notion_page": "https://app.notion.com/p/39c3e0f93a808168b559f567c9714c4d",
      "sources": [
        { "label": "paper (arXiv 2510.04721)", "url": "https://arxiv.org/abs/2510.04721", "status": "fetched, live 2026-07-12" },
        { "label": "NeurIPS 2025 listing", "url": "https://neurips.cc/virtual/2025/131116", "status": "fetched; listing confirmed" },
        { "label": "project site", "url": "https://sycophanticmath.ai/", "status": "fetched, live" },
        { "label": "code", "url": "https://github.com/insait-institute/broken-math", "status": "fetched, live; not file-audited" },
        { "label": "dataset", "url": "https://huggingface.co/datasets/INSAIT-Institute/BrokenMath", "status": "fetched, live; downloadable" }
      ],
      "behaviour_ids": [1],
      "facets": ["1.1"],
      "quality": { "internal_validity": 4, "external_validity": 2, "reproducibility": 4 },
      "quality_confidence": { "internal_validity": "medium-high (D4 uncertainty reporting unverified)", "external_validity": "high", "reproducibility": "medium-high (repo not file-audited)" },
      "adherence": {
        "anthropic": { "band": null, "provenance": "no Claude models evaluated in v1" },
        "openai": { "band": 2, "provenance": "GPT-5 attempts to prove 29.0% of expert-verified false theorems (best of ~10 models, 2025)" }
      },
      "featured": true,
      "notes": "Most rigorous 1.1 instrument found: 504 expert-verified false theorems from fresh 2025 competition problems (contamination-resistant), judge validated at 95% agreement on 250 hand-labeled responses, full code+data release. Domain-narrow (competition math only)."
    },
    {
      "id": "syceval-fanous-2025",
      "name": "SycEval",
      "url": "https://arxiv.org/abs/2502.08177",
      "org": "Fanous et al. 2025, Stanford (AIES 2025)",
      "notion_page": "https://app.notion.com/p/39c3e0f93a8081638e2ad73c4c49e6d5",
      "sources": [
        { "label": "paper (arXiv 2502.08177)", "url": "https://arxiv.org/abs/2502.08177", "status": "fetched, live 2026-07-12" },
        { "label": "published (AIES-25, DOI 10.1609/aies.v8i1.36598)", "url": "https://ojs.aaai.org/index.php/AIES/article/view/36598", "status": "fetched, live; PDF downloadable" },
        { "label": "code", "url": null, "status": "does not exist -- verified by search; no availability statement" },
        { "label": "data (samples + rebuttals)", "url": null, "status": "not released" },
        { "label": "underlying public sources: AMPS/MATH, MedQuAD", "url": "https://github.com/hendrycks/math", "status": "third-party datasets; not live-checked this sweep" },
        { "label": "context: construct-fragmentation survey", "url": "https://arxiv.org/abs/2605.21778", "status": "fetched, live" }
      ],
      "behaviour_ids": [1],
      "facets": ["1.3", "1.1"],
      "quality": { "internal_validity": 3, "external_validity": 2, "reproducibility": 1 },
      "quality_confidence": { "internal_validity": "medium-high", "external_validity": "high", "reproducibility": "high" },
      "adherence": {
        "anthropic": { "band": 2, "provenance": "Claude-Sonnet (version unpinned, likely 3.5): 18.31% regressive sycophancy (2025)" },
        "openai": { "band": 2, "provenance": "ChatGPT-4o (2024-05-13): 14.40% regressive sycophancy (2025)" }
      },
      "featured": false,
      "notes": "Control-run then rebuttal design on medical + math; rebuttal-strength gradient; proper statistics (binomial CIs, z-tests). Introduces the progressive/regressive split (only regressive flips are in-scope for our behaviour). No code, data, or prompts released; Claude/Gemini versions unpinned."
    },
    {
      "id": "sycon-bench-hong-2025",
      "name": "SYCON-Bench",
      "url": "https://aclanthology.org/2025.findings-emnlp.121/",
      "org": "Hong et al. 2025, Emory / CMU (Findings of EMNLP 2025)",
      "notion_page": "https://app.notion.com/p/39c3e0f93a80812b9c2bd84c493eebae",
      "sources": [
        { "label": "published (ACL Anthology)", "url": "https://aclanthology.org/2025.findings-emnlp.121/", "status": "fetched, live 2026-07-12" },
        { "label": "paper (arXiv 2505.23840)", "url": "https://arxiv.org/abs/2505.23840", "status": "fetched, live" },
        { "label": "code + data (MIT)", "url": "https://github.com/JiseungHong/SYCON-Bench", "status": "fetched, live; not file-audited" },
        { "label": "judge-sensitivity follow-up (arXiv 2606.16617)", "url": "https://arxiv.org/abs/2606.16617", "status": "fetched, live" }
      ],
      "behaviour_ids": [1],
      "facets": ["1.3", "1.1"],
      "quality": { "internal_validity": 3, "external_validity": 3, "reproducibility": 3 },
      "quality_confidence": { "internal_validity": "medium (several items unverified pending PDF extraction)", "external_validity": "medium-high", "reproducibility": "medium" },
      "adherence": {
        "anthropic": { "band": null, "provenance": "per-model tables in paper not yet extracted" },
        "openai": { "band": null, "provenance": "per-model tables in paper not yet extracted" }
      },
      "featured": false,
      "notes": "Strongest peer-reviewed pushback-stability instrument: multi-turn sustained pressure, continuous Turn-of-Flip metric, 17 models, code+data (MIT). Mixes opinion stances with factual ones; follow-up work shows judge agreement on false presuppositions can drop to kappa 0.36. Highest-value follow-up: extract per-model tables."
    },
    {
      "id": "elephant-cheng-2025",
      "name": "ELEPHANT",
      "url": "https://arxiv.org/abs/2505.13995",
      "org": "Cheng et al. 2025, Stanford (ICLR 2026)",
      "notion_page": "https://app.notion.com/p/39c3e0f93a8081ca8a47ebdc6aec645a",
      "sources": [
        { "label": "paper (arXiv 2505.13995)", "url": "https://arxiv.org/abs/2505.13995", "status": "fetched, live 2026-07-12" },
        { "label": "ICLR 2026 (OpenReview igbRHKEiAs)", "url": "https://openreview.net/pdf?id=igbRHKEiAs", "status": "exists; Cloudflare-gated -- PDF/reviews not read" },
        { "label": "ICLR 2026 poster page", "url": "https://iclr.cc/virtual/2026/poster/10007944", "status": "agent-reported listing" },
        { "label": "code (CC0)", "url": "https://github.com/myracheng/elephant", "status": "fetched; contents listed (scorers, sample datasets, full paper results)" },
        { "label": "full datasets (OSF view-only)", "url": "https://osf.io/r3dmj/?view_only=37ee66a8020a45c29a38bd704ca61067", "status": "reachable via tokened link; node not public (verified via OSF API)" },